{
  "schemaVersion": "1.0",
  "title": "二甲戊灵合成流程",
  "description": "根据12步工艺流程描述生成的完整测试数据。明确串联的设备逐台展开，未明确内部连接的同类设备组采用聚合节点。",
  "functionalAreas": [
    {
      "id": "area_feed_salt",
      "name": "原料配制与成盐",
      "description": "完成硝酸配制、计量、预成盐、成盐及成盐液分离。",
      "nodeIds": ["src_concentrated_nitric_acid", "src_dilute_nitric_acid", "src_pentylamine", "eq_R1008", "eq_V1064", "eq_91ab02fe", "eq_X1001", "eq_R1010", "eq_R1020", "eq_M1003"]
    },
    {
      "id": "area_nitration",
      "name": "连续硝化",
      "description": "成盐液经三级连续硝化，并汇集处理硝化气相。",
      "nodeIds": ["src_metered_nitric_acid", "eq_a3f61c9d", "eq_R1012A", "eq_R1012B", "eq_R1012C", "eq_f3190b7e", "sink_nitration_offgas"]
    },
    {
      "id": "area_neutralization",
      "name": "中和分相与水洗",
      "description": "硝化液完成中和、油水分离、水洗和暂存。",
      "nodeIds": ["src_acid", "src_alkali", "src_process_water", "src_wash_water", "eq_R1013AB", "eq_M1006AB", "eq_R1014AB", "eq_V1038AB", "sink_acid_water_recovery"]
    },
    {
      "id": "area_deazotization",
      "name": "脱亚硝",
      "description": "硝化液转料后加入辅助物料脱亚硝，并冷凝处理气相。",
      "nodeIds": ["src_hydrochloric_acid", "src_sulfamic_acid", "eq_75ce091b", "eq_TC125", "eq_R1015AE", "eq_E1008AE", "sink_deazotization_condensate"]
    },
    {
      "id": "area_post_wash",
      "name": "脱亚硝后水洗",
      "description": "脱亚硝物料经水洗和沉降分层，分出油相与废水。",
      "nodeIds": ["eq_R1025AB", "eq_R1026AB", "sink_wastewater_treatment"]
    },
    {
      "id": "area_solvent_recovery",
      "name": "脱溶与溶剂回收",
      "description": "油相脱除二氯乙烷，并对冷凝溶剂进行接收和分流。",
      "nodeIds": ["eq_R1022BE", "eq_E1011BE", "eq_V1063AB", "sink_dce_reuse", "sink_offspec_disposal"]
    },
    {
      "id": "area_refining",
      "name": "精制与产品成型",
      "description": "粗品经精制、重结晶、固液分离、热储和切片形成产品。",
      "nodeIds": ["src_refining_solvent", "eq_43d7c102", "eq_5c8a31ef", "sink_mother_liquor", "eq_R1027", "eq_M1012", "eq_V1060"]
    },
    {
      "id": "area_packaging",
      "name": "包装与粉尘收集",
      "description": "切片产品进入包装线，包装和切片粉尘统一收集。",
      "nodeIds": ["eq_M1013_C2001", "eq_M1021_M1027", "sink_collected_dust", "sink_finished_goods_warehouse"]
    }
  ],
  "nodes": [
    {
      "id": "src_concentrated_nitric_acid",
      "kind": "source",
      "tag": null,
      "name": "浓硝酸",
      "equipmentType": null,
      "shapeKey": "boundary.source",
      "ports": [
        { "id": "out-1", "direction": "out", "role": "material" }
      ],
      "attributes": {}
    },
    {
      "id": "src_dilute_nitric_acid",
      "kind": "source",
      "tag": null,
      "name": "稀硝酸",
      "equipmentType": null,
      "shapeKey": "boundary.source",
      "ports": [
        { "id": "out-1", "direction": "out", "role": "material" }
      ],
      "attributes": {}
    },
    {
      "id": "src_pentylamine",
      "kind": "source",
      "tag": null,
      "name": "戊胺",
      "equipmentType": null,
      "shapeKey": "boundary.source",
      "ports": [
        { "id": "out-1", "direction": "out", "role": "material" }
      ],
      "attributes": {}
    },
    {
      "id": "src_metered_nitric_acid",
      "kind": "source",
      "tag": null,
      "name": "硝化用计量硝酸",
      "equipmentType": null,
      "shapeKey": "boundary.source",
      "ports": [
        { "id": "out-1", "direction": "out", "role": "material" }
      ],
      "attributes": {}
    },
    {
      "id": "src_acid",
      "kind": "source",
      "tag": null,
      "name": "中和调节用酸",
      "equipmentType": null,
      "shapeKey": "boundary.source",
      "ports": [
        { "id": "out-1", "direction": "out", "role": "material" }
      ],
      "attributes": {}
    },
    {
      "id": "src_alkali",
      "kind": "source",
      "tag": null,
      "name": "中和用碱",
      "equipmentType": null,
      "shapeKey": "boundary.source",
      "ports": [
        { "id": "out-1", "direction": "out", "role": "material" }
      ],
      "attributes": {}
    },
    {
      "id": "src_process_water",
      "kind": "source",
      "tag": null,
      "name": "中和调节用水",
      "equipmentType": null,
      "shapeKey": "boundary.source",
      "ports": [
        { "id": "out-1", "direction": "out", "role": "utility" }
      ],
      "attributes": {}
    },
    {
      "id": "src_wash_water",
      "kind": "source",
      "tag": null,
      "name": "洗涤水",
      "equipmentType": null,
      "shapeKey": "boundary.source",
      "ports": [
        { "id": "out-1", "direction": "out", "role": "utility" }
      ],
      "attributes": {}
    },
    {
      "id": "src_hydrochloric_acid",
      "kind": "source",
      "tag": null,
      "name": "盐酸",
      "equipmentType": null,
      "shapeKey": "boundary.source",
      "ports": [
        { "id": "out-1", "direction": "out", "role": "material" }
      ],
      "attributes": {}
    },
    {
      "id": "src_sulfamic_acid",
      "kind": "source",
      "tag": null,
      "name": "氨基磺酸",
      "equipmentType": null,
      "shapeKey": "boundary.source",
      "ports": [
        { "id": "out-1", "direction": "out", "role": "material" }
      ],
      "attributes": {}
    },
    {
      "id": "src_refining_solvent",
      "kind": "source",
      "tag": null,
      "name": "精制溶剂",
      "equipmentType": null,
      "shapeKey": "boundary.source",
      "ports": [
        { "id": "out-1", "direction": "out", "role": "material" }
      ],
      "attributes": {}
    },
    {
      "id": "eq_R1008",
      "kind": "equipment",
      "tag": "R1008",
      "name": "硝酸配制釜",
      "equipmentType": "硝酸配制釜",
      "shapeKey": "vessel.stirred",
      "ports": [
        { "id": "in-concentrated", "direction": "in", "role": "material", "label": "浓硝酸入口" },
        { "id": "in-dilute", "direction": "in", "role": "material", "label": "稀硝酸入口" },
        { "id": "out-1", "direction": "out", "role": "material" }
      ],
      "attributes": { "operation": "硝酸浓度调整" }
    },
    {
      "id": "eq_V1064",
      "kind": "equipment",
      "tag": "V1064",
      "name": "配酸罐",
      "equipmentType": "硝酸暂存罐",
      "shapeKey": "tank.vertical",
      "ports": [
        { "id": "in-1", "direction": "in", "role": "material" },
        { "id": "out-1", "direction": "out", "role": "material" }
      ],
      "attributes": { "operation": "合格硝酸暂存" }
    },
    {
      "id": "eq_91ab02fe",
      "kind": "equipment",
      "tag": null,
      "name": "硝酸计量输送设备",
      "equipmentType": "计量输送设备",
      "shapeKey": "machine.metering",
      "ports": [
        { "id": "in-1", "direction": "in", "role": "material" },
        { "id": "out-1", "direction": "out", "role": "material" }
      ],
      "attributes": { "generatedId": true }
    },
    {
      "id": "eq_X1001",
      "kind": "equipment",
      "tag": "X1001",
      "name": "预成盐管式反应器",
      "equipmentType": "管式反应器",
      "shapeKey": "reactor.tubular",
      "ports": [
        { "id": "in-amine", "direction": "in", "role": "material", "label": "戊胺入口" },
        { "id": "in-nitric", "direction": "in", "role": "material", "label": "硝酸入口" },
        { "id": "out-1", "direction": "out", "role": "material" }
      ],
      "attributes": { "operation": "连续预成盐" }
    },
    {
      "id": "eq_R1010",
      "kind": "equipment",
      "tag": "R1010",
      "name": "成盐釜",
      "equipmentType": "成盐反应釜",
      "shapeKey": "vessel.stirred",
      "ports": [
        { "id": "in-1", "direction": "in", "role": "material" },
        { "id": "out-1", "direction": "out", "role": "material" }
      ],
      "attributes": { "operation": "完成成盐" }
    },
    {
      "id": "eq_R1020",
      "kind": "equipment",
      "tag": "R1020",
      "name": "热储釜",
      "equipmentType": "保温储存釜",
      "shapeKey": "vessel.heated",
      "ports": [
        { "id": "in-1", "direction": "in", "role": "material" },
        { "id": "out-1", "direction": "out", "role": "material" }
      ],
      "attributes": { "operation": "保温暂存" }
    },
    {
      "id": "eq_M1003",
      "kind": "equipment",
      "tag": "M1003",
      "name": "成盐分离器",
      "equipmentType": "液液分离器",
      "shapeKey": "separator.phase",
      "ports": [
        { "id": "in-1", "direction": "in", "role": "material" },
        { "id": "out-salt", "direction": "out", "role": "material", "label": "成盐液" },
        { "id": "out-water", "direction": "out", "role": "waste", "label": "水相或酸水" }
      ],
      "attributes": { "operation": "相分离" }
    },
    {
      "id": "eq_a3f61c9d",
      "kind": "equipment",
      "tag": null,
      "name": "连续硝化进料系统",
      "equipmentType": "进料系统",
      "shapeKey": "system.feeding",
      "ports": [
        { "id": "in-1", "direction": "in", "role": "material" },
        { "id": "out-1", "direction": "out", "role": "material" }
      ],
      "attributes": { "generatedId": true }
    },
    {
      "id": "eq_R1012A",
      "kind": "equipment",
      "tag": "R1012A",
      "name": "一级硝化釜",
      "equipmentType": "连续硝化釜",
      "shapeKey": "vessel.stirred",
      "ports": [
        { "id": "in-salt", "direction": "in", "role": "material" },
        { "id": "in-nitric", "direction": "in", "role": "material" },
        { "id": "out-1", "direction": "out", "role": "material" },
        { "id": "out-gas", "direction": "out", "role": "gas" }
      ],
      "attributes": { "seriesOrder": 1 }
    },
    {
      "id": "eq_R1012B",
      "kind": "equipment",
      "tag": "R1012B",
      "name": "二级硝化釜",
      "equipmentType": "连续硝化釜",
      "shapeKey": "vessel.stirred",
      "ports": [
        { "id": "in-1", "direction": "in", "role": "material" },
        { "id": "out-1", "direction": "out", "role": "material" },
        { "id": "out-gas", "direction": "out", "role": "gas" }
      ],
      "attributes": { "seriesOrder": 2 }
    },
    {
      "id": "eq_R1012C",
      "kind": "equipment",
      "tag": "R1012C",
      "name": "三级硝化釜",
      "equipmentType": "连续硝化釜",
      "shapeKey": "vessel.stirred",
      "ports": [
        { "id": "in-1", "direction": "in", "role": "material" },